[
  {
    "id": "first-day-plovdiv",
    "title_bg": "Първи ден в Пловдив",
    "title_en": "First day in Plovdiv",
    "short_title_bg": "Първи ден",
    "short_title_en": "First day",
    "tagline_bg": "главната улица, Капана, Старият град и залез от тепето",
    "tagline_en": "the main street, Kapana, the Old Town and a hilltop sunset",
    "summary_bg": "Обиколка за първо запознанство: започвате от градината, минавате по пешеходната главна улица покрай Античния стадион, потапяте се в Капана и Стария град и завършвате със залез от Небет тепе. Всичко най-важно за един ден, без бързане.",
    "summary_en": "The get-to-know-Plovdiv loop: start in the city garden, follow the pedestrian main street past the Ancient Stadium, dive into Kapana and the Old Town, and finish with sunset from Nebet Tepe. The essentials in one unhurried day.",
    "category": "first-visit",
    "duration_minutes": 330,
    "duration_band": "full-day",
    "walking_only_note": false,
    "difficulty": "moderate",
    "wheelchair": "partial",
    "wheelchair_note_bg": "Равно по главната улица и в Капана; калдъръмът и наклонът в Стария град са трудни за колела — за маршрут без стъпала вижте „Пловдив без стъпала“.",
    "wheelchair_note_en": "Level along the main street and in Kapana; the Old Town's cobbles and slopes are hard on wheels — see the step-free route for a fully level walk.",
    "family_friendly": true,
    "rainy_day_ok": false,
    "transit_required": false,
    "best_time_bg": "Тръгнете следобед, за да стигнете Небет тепе по залез.",
    "best_time_en": "Start after lunch so you reach Nebet Tepe around sunset.",
    "accent": "#15657f",
    "story_id": "story-deep-time-seven-hills",
    "education_id": "education-seven-hills-deep-time",
    "stops": [
      {
        "place_id": "place-tzar-simeon-garden-q12298697",
        "minutes": 25,
        "note_bg": "Започнете от градината с фонтаните — най-лесното място за ориентация и първо кафе.",
        "note_en": "Start in the fountain garden — the easiest place to get oriented and grab a first coffee."
      },
      {
        "place_id": "place-stefan-stambolov-square-plovdiv-q59441964",
        "minutes": 15,
        "note_bg": "Централният площад пред общината отваря пешеходната главна улица на север.",
        "note_en": "The central square by the municipality opens onto the pedestrian main street heading north."
      },
      {
        "place_id": "place-ancient-stadium",
        "minutes": 25,
        "note_bg": "Северният завой на римския стадион се вижда от нивото на площад Джумая; слезте до експозицията, ако е отворена.",
        "note_en": "The Roman stadium's northern curve is visible from Dzhumaya square level; descend to the exhibition space if it is open."
      },
      {
        "place_id": "place-dzhumaya-mosque",
        "minutes": 15,
        "note_bg": "Действащата джамия до стадиона е една от най-старите османски сгради в града.",
        "note_en": "The working mosque beside the stadium is one of the city's oldest Ottoman buildings."
      },
      {
        "place_id": "place-kapana-q12282547",
        "minutes": 60,
        "note_bg": "Кварталът на занаятите е идеален за обяд: пешеходни улички, галерии и малки магазини.",
        "note_en": "The creative quarter is the natural lunch break: pedestrian lanes, galleries and small shops."
      },
      {
        "place_id": "place-old-town",
        "minutes": 60,
        "note_bg": "Изкачете се по калдъръма между възрожденските къщи; носете удобни обувки.",
        "note_en": "Climb the cobbled lanes between the Revival-era houses; sturdy shoes help here."
      },
      {
        "place_id": "place-ancient-theatre",
        "minutes": 30,
        "note_bg": "Античният театър е най-емблематичната гледка в града — проверете дали няма събитие вечерта.",
        "note_en": "The Ancient Theatre is the city's signature view — check whether an evening event is scheduled."
      },
      {
        "place_id": "place-nebet-tepe",
        "minutes": 40,
        "note_bg": "Финал на северния край на Трихълмието: панорама към Марица и класическото място за залез.",
        "note_en": "Finish at the northern tip of the Three Hills: a panorama over the Maritsa and the classic sunset spot."
      }
    ],
    "detours": [
      {
        "place_id": "place-hisar-kapia",
        "note_bg": "Средновековната порта е на две минути от църквата „Св. св. Константин и Елена“ в Стария град.",
        "note_en": "The medieval gate is a two-minute side step inside the Old Town, next to the Church of St Constantine and Helena."
      },
      {
        "place_id": "place-plovdiv-regional-ethnographic-museum-q876619",
        "note_bg": "Ако имате сили, къщата с емблематичния двор е сред най-фотографираните в Стария град.",
        "note_en": "If you have energy left, the museum house with its famous courtyard is among the Old Town's most photographed."
      }
    ],
    "start_guidance_bg": "Градината „Цар Симеон“ е на 15–20 минути пеша от жп гарата или няколко минути с такси; всички централни автобусни линии спират наблизо.",
    "start_guidance_en": "Tzar Simeon Garden is a 15–20 minute walk from the railway station or a short taxi ride; most central bus lines stop nearby.",
    "end_guidance_bg": "От Небет тепе се слиза за 10 минути обратно до Капана, където вечерта продължава; такситата се хващат най-лесно при площад Джумая.",
    "end_guidance_en": "From Nebet Tepe it is a 10-minute walk back down to Kapana for the evening; taxis are easiest to find around Dzhumaya square.",
    "practical": [
      {
        "kind": "terrain",
        "text_bg": "Калдъръмът в Стария град е хлъзгав при дъжд — обувки със стабилна подметка.",
        "text_en": "Old Town cobbles get slippery when wet — wear shoes with decent grip."
      },
      {
        "kind": "food",
        "text_bg": "Най-голям избор за обяд и вечеря има в Капана и по главната улица.",
        "text_en": "The widest food choice is in Kapana and along the main street."
      },
      {
        "kind": "water",
        "text_bg": "Лятото е горещо — носете вода; сянката по тепетата е малко.",
        "text_en": "Summers run hot — carry water; shade on the hills is limited."
      }
    ],
    "caveats": [
      {
        "text_bg": "Работното време на стадиона, театъра и къщите музеи се променя — проверявайте преди посещение; улиците и панорамите са достъпни по всяко време.",
        "text_en": "Opening hours for the stadium, theatre and house museums change — check before you visit; the streets and viewpoints are open at all times."
      }
    ],
    "data_quality": "editorial_route_guidance",
    "updated_at": "2026-07-07"
  },
  {
    "id": "roman-plovdiv-90",
    "title_bg": "Римски Пловдив за 90 минути",
    "title_en": "Roman Plovdiv in 90 minutes",
    "short_title_bg": "Римски Пловдив",
    "short_title_en": "Roman Plovdiv",
    "tagline_bg": "антични сцени, стадион и форум",
    "tagline_en": "ancient stages, stadium and forum",
    "summary_bg": "Компактна обиколка на античния Филипопол: от акропола на Небет тепе през театъра и епископската базилика до форума, одеона и стадиона. Всеки етап стъпва върху публикуваните записи за римския град.",
    "summary_en": "A compact circuit of ancient Philippopolis: from the Nebet Tepe acropolis past the theatre and the Bishop's Basilica to the forum, the odeon and the stadium. Every leg follows the published records of the Roman city.",
    "category": "history-layers",
    "duration_minutes": 90,
    "duration_band": "half-day",
    "difficulty": "moderate",
    "wheelchair": "hard",
    "wheelchair_note_bg": "Небет тепе и театърът са по калдъръм и стълби; форумът, одеонът и стадионът са достъпни от ниво улица.",
    "wheelchair_note_en": "Nebet Tepe and the theatre involve cobbles and stairs; the forum, odeon and stadium can be seen from street level.",
    "family_friendly": true,
    "rainy_day_ok": false,
    "transit_required": false,
    "best_time_bg": "Сутрин, преди жегата — театърът и тепето са без сянка.",
    "best_time_en": "Morning, before the heat — the theatre and the hilltop have little shade.",
    "accent": "#a23b2d",
    "story_id": "story-roman-philippopolis",
    "education_id": "education-roman-philippopolis",
    "stops": [
      {
        "place_id": "place-nebet-tepe",
        "minutes": 15,
        "note_bg": "Започнете от най-стария обитаван пласт на града — крепостните останки на върха.",
        "note_en": "Start at the city's oldest inhabited layer — the fortress remains on the summit."
      },
      {
        "place_id": "place-ancient-theatre",
        "minutes": 15,
        "note_bg": "Слезте по калдъръма до театъра между Джамбаз и Таксим тепе.",
        "note_en": "Walk down the cobbles to the theatre saddled between Dzhambaz and Taksim hills."
      },
      {
        "place_id": "place-bishop-s-basilica-of-philippopolis-q20500169",
        "minutes": 10,
        "note_bg": "Мозайките на раннохристиянската базилика се разглеждат в модерната защитна сграда.",
        "note_en": "The early-Christian basilica's mosaics are displayed inside the modern protective building."
      },
      {
        "place_id": "place-forum-philippopolis",
        "minutes": 5,
        "note_bg": "Останките от градския площад на Филипопол са до Централна поща.",
        "note_en": "The remains of Philippopolis's civic square sit beside the Central Post Office."
      },
      {
        "place_id": "place-odeon-of-philippopolis-q26046109",
        "minutes": 5,
        "note_bg": "Малката покрита сцена на форума е на крачка от северния му ъгъл.",
        "note_en": "The forum's small roofed stage is a step away from its northern corner."
      },
      {
        "place_id": "place-ancient-stadium",
        "minutes": 10,
        "note_bg": "Финал при северния завой на стадиона под площад Джумая.",
        "note_en": "Finish at the stadium's northern curve beneath Dzhumaya square."
      }
    ],